{
  "title": "Revenge of the Sith",
  "episode_id": 3,
  "opening_crawl": "War! The Republic is crumbling\r\nunder attacks by the ruthless\r\nSith Lord, Count Dooku.\r\nThere are heroes on both sides.\r\nEvil is everywhere.\r\n\r\nIn a stunning move, the\r\nfiendish droid leader, General\r\nGrievous, has swept into the\r\nRepublic capital and kidnapped\r\nChancellor Palpatine, leader of\r\nthe Galactic Senate.\r\n\r\nAs the Separatist Droid Army\r\nattempts to flee the besieged\r\ncapital with their valuable\r\nhostage, two Jedi Knights lead a\r\ndesperate mission to rescue the\r\ncaptive Chancellor....",
  "director": "George Lucas",
  "producer": "Rick McCallum",
  "release_date": "2005-05-19",
  "characters": [
    "https://sw.simplr.sh/api/people/1.json",
    "https://sw.simplr.sh/api/people/2.json",
    "https://sw.simplr.sh/api/people/3.json",
    "https://sw.simplr.sh/api/people/4.json",
    "https://sw.simplr.sh/api/people/5.json",
    "https://sw.simplr.sh/api/people/6.json",
    "https://sw.simplr.sh/api/people/7.json",
    "https://sw.simplr.sh/api/people/10.json",
    "https://sw.simplr.sh/api/people/11.json",
    "https://sw.simplr.sh/api/people/12.json",
    "https://sw.simplr.sh/api/people/13.json",
    "https://sw.simplr.sh/api/people/20.json",
    "https://sw.simplr.sh/api/people/21.json",
    "https://sw.simplr.sh/api/people/33.json",
    "https://sw.simplr.sh/api/people/35.json",
    "https://sw.simplr.sh/api/people/46.json",
    "https://sw.simplr.sh/api/people/51.json",
    "https://sw.simplr.sh/api/people/52.json",
    "https://sw.simplr.sh/api/people/53.json",
    "https://sw.simplr.sh/api/people/54.json",
    "https://sw.simplr.sh/api/people/55.json",
    "https://sw.simplr.sh/api/people/56.json",
    "https://sw.simplr.sh/api/people/58.json",
    "https://sw.simplr.sh/api/people/63.json",
    "https://sw.simplr.sh/api/people/64.json",
    "https://sw.simplr.sh/api/people/67.json",
    "https://sw.simplr.sh/api/people/68.json",
    "https://sw.simplr.sh/api/people/75.json",
    "https://sw.simplr.sh/api/people/78.json",
    "https://sw.simplr.sh/api/people/79.json",
    "https://sw.simplr.sh/api/people/80.json",
    "https://sw.simplr.sh/api/people/81.json",
    "https://sw.simplr.sh/api/people/82.json",
    "https://sw.simplr.sh/api/people/83.json"
  ],
  "planets": [
    "https://sw.simplr.sh/api/planets/1.json",
    "https://sw.simplr.sh/api/planets/2.json",
    "https://sw.simplr.sh/api/planets/5.json",
    "https://sw.simplr.sh/api/planets/8.json",
    "https://sw.simplr.sh/api/planets/9.json",
    "https://sw.simplr.sh/api/planets/12.json",
    "https://sw.simplr.sh/api/planets/13.json",
    "https://sw.simplr.sh/api/planets/14.json",
    "https://sw.simplr.sh/api/planets/15.json",
    "https://sw.simplr.sh/api/planets/16.json",
    "https://sw.simplr.sh/api/planets/17.json",
    "https://sw.simplr.sh/api/planets/18.json",
    "https://sw.simplr.sh/api/planets/19.json"
  ],
  "starships": [
    "https://sw.simplr.sh/api/starships/2.json",
    "https://sw.simplr.sh/api/starships/32.json",
    "https://sw.simplr.sh/api/starships/48.json",
    "https://sw.simplr.sh/api/starships/59.json",
    "https://sw.simplr.sh/api/starships/61.json",
    "https://sw.simplr.sh/api/starships/63.json",
    "https://sw.simplr.sh/api/starships/64.json",
    "https://sw.simplr.sh/api/starships/65.json",
    "https://sw.simplr.sh/api/starships/66.json",
    "https://sw.simplr.sh/api/starships/68.json",
    "https://sw.simplr.sh/api/starships/74.json",
    "https://sw.simplr.sh/api/starships/75.json"
  ],
  "vehicles": [
    "https://sw.simplr.sh/api/vehicles/33.json",
    "https://sw.simplr.sh/api/vehicles/50.json",
    "https://sw.simplr.sh/api/vehicles/53.json",
    "https://sw.simplr.sh/api/vehicles/56.json",
    "https://sw.simplr.sh/api/vehicles/60.json",
    "https://sw.simplr.sh/api/vehicles/62.json",
    "https://sw.simplr.sh/api/vehicles/67.json",
    "https://sw.simplr.sh/api/vehicles/69.json",
    "https://sw.simplr.sh/api/vehicles/70.json",
    "https://sw.simplr.sh/api/vehicles/71.json",
    "https://sw.simplr.sh/api/vehicles/72.json",
    "https://sw.simplr.sh/api/vehicles/73.json",
    "https://sw.simplr.sh/api/vehicles/76.json"
  ],
  "species": [
    "https://sw.simplr.sh/api/species/1.json",
    "https://sw.simplr.sh/api/species/2.json",
    "https://sw.simplr.sh/api/species/3.json",
    "https://sw.simplr.sh/api/species/6.json",
    "https://sw.simplr.sh/api/species/15.json",
    "https://sw.simplr.sh/api/species/19.json",
    "https://sw.simplr.sh/api/species/20.json",
    "https://sw.simplr.sh/api/species/23.json",
    "https://sw.simplr.sh/api/species/24.json",
    "https://sw.simplr.sh/api/species/25.json",
    "https://sw.simplr.sh/api/species/26.json",
    "https://sw.simplr.sh/api/species/27.json",
    "https://sw.simplr.sh/api/species/28.json",
    "https://sw.simplr.sh/api/species/29.json",
    "https://sw.simplr.sh/api/species/30.json",
    "https://sw.simplr.sh/api/species/33.json",
    "https://sw.simplr.sh/api/species/34.json",
    "https://sw.simplr.sh/api/species/35.json",
    "https://sw.simplr.sh/api/species/36.json",
    "https://sw.simplr.sh/api/species/37.json"
  ],
  "created": "2014-12-20T18:49:38.403000Z",
  "edited": "2014-12-20T20:47:52.073000Z",
  "url": "https://sw.simplr.sh/api/films/6.json"
}
