{
  "title": "Attack of the Clones",
  "episode_id": 2,
  "opening_crawl": "There is unrest in the Galactic\r\nSenate. Several thousand solar\r\nsystems have declared their\r\nintentions to leave the Republic.\r\n\r\nThis separatist movement,\r\nunder the leadership of the\r\nmysterious Count Dooku, has\r\nmade it difficult for the limited\r\nnumber of Jedi Knights to maintain \r\npeace and order in the galaxy.\r\n\r\nSenator Amidala, the former\r\nQueen of Naboo, is returning\r\nto the Galactic Senate to vote\r\non the critical issue of creating\r\nan ARMY OF THE REPUBLIC\r\nto assist the overwhelmed\r\nJedi....",
  "director": "George Lucas",
  "producer": "Rick McCallum",
  "release_date": "2002-05-16",
  "characters": [
    "https://sw.simplr.sh/api/people/2.json",
    "https://sw.simplr.sh/api/people/3.json",
    "https://sw.simplr.sh/api/people/6.json",
    "https://sw.simplr.sh/api/people/7.json",
    "https://sw.simplr.sh/api/people/10.json",
    "https://sw.simplr.sh/api/people/11.json",
    "https://sw.simplr.sh/api/people/20.json",
    "https://sw.simplr.sh/api/people/21.json",
    "https://sw.simplr.sh/api/people/22.json",
    "https://sw.simplr.sh/api/people/33.json",
    "https://sw.simplr.sh/api/people/35.json",
    "https://sw.simplr.sh/api/people/36.json",
    "https://sw.simplr.sh/api/people/40.json",
    "https://sw.simplr.sh/api/people/43.json",
    "https://sw.simplr.sh/api/people/46.json",
    "https://sw.simplr.sh/api/people/51.json",
    "https://sw.simplr.sh/api/people/52.json",
    "https://sw.simplr.sh/api/people/53.json",
    "https://sw.simplr.sh/api/people/58.json",
    "https://sw.simplr.sh/api/people/59.json",
    "https://sw.simplr.sh/api/people/60.json",
    "https://sw.simplr.sh/api/people/61.json",
    "https://sw.simplr.sh/api/people/62.json",
    "https://sw.simplr.sh/api/people/63.json",
    "https://sw.simplr.sh/api/people/64.json",
    "https://sw.simplr.sh/api/people/65.json",
    "https://sw.simplr.sh/api/people/66.json",
    "https://sw.simplr.sh/api/people/67.json",
    "https://sw.simplr.sh/api/people/68.json",
    "https://sw.simplr.sh/api/people/69.json",
    "https://sw.simplr.sh/api/people/70.json",
    "https://sw.simplr.sh/api/people/71.json",
    "https://sw.simplr.sh/api/people/72.json",
    "https://sw.simplr.sh/api/people/73.json",
    "https://sw.simplr.sh/api/people/74.json",
    "https://sw.simplr.sh/api/people/75.json",
    "https://sw.simplr.sh/api/people/76.json",
    "https://sw.simplr.sh/api/people/77.json",
    "https://sw.simplr.sh/api/people/78.json",
    "https://sw.simplr.sh/api/people/82.json"
  ],
  "planets": [
    "https://sw.simplr.sh/api/planets/1.json",
    "https://sw.simplr.sh/api/planets/8.json",
    "https://sw.simplr.sh/api/planets/9.json",
    "https://sw.simplr.sh/api/planets/10.json",
    "https://sw.simplr.sh/api/planets/11.json"
  ],
  "starships": [
    "https://sw.simplr.sh/api/starships/21.json",
    "https://sw.simplr.sh/api/starships/32.json",
    "https://sw.simplr.sh/api/starships/39.json",
    "https://sw.simplr.sh/api/starships/43.json",
    "https://sw.simplr.sh/api/starships/47.json",
    "https://sw.simplr.sh/api/starships/48.json",
    "https://sw.simplr.sh/api/starships/49.json",
    "https://sw.simplr.sh/api/starships/52.json",
    "https://sw.simplr.sh/api/starships/58.json"
  ],
  "vehicles": [
    "https://sw.simplr.sh/api/vehicles/4.json",
    "https://sw.simplr.sh/api/vehicles/44.json",
    "https://sw.simplr.sh/api/vehicles/45.json",
    "https://sw.simplr.sh/api/vehicles/46.json",
    "https://sw.simplr.sh/api/vehicles/50.json",
    "https://sw.simplr.sh/api/vehicles/51.json",
    "https://sw.simplr.sh/api/vehicles/53.json",
    "https://sw.simplr.sh/api/vehicles/54.json",
    "https://sw.simplr.sh/api/vehicles/55.json",
    "https://sw.simplr.sh/api/vehicles/56.json",
    "https://sw.simplr.sh/api/vehicles/57.json"
  ],
  "species": [
    "https://sw.simplr.sh/api/species/1.json",
    "https://sw.simplr.sh/api/species/2.json",
    "https://sw.simplr.sh/api/species/6.json",
    "https://sw.simplr.sh/api/species/12.json",
    "https://sw.simplr.sh/api/species/13.json",
    "https://sw.simplr.sh/api/species/15.json",
    "https://sw.simplr.sh/api/species/28.json",
    "https://sw.simplr.sh/api/species/29.json",
    "https://sw.simplr.sh/api/species/30.json",
    "https://sw.simplr.sh/api/species/31.json",
    "https://sw.simplr.sh/api/species/32.json",
    "https://sw.simplr.sh/api/species/33.json",
    "https://sw.simplr.sh/api/species/34.json",
    "https://sw.simplr.sh/api/species/35.json"
  ],
  "created": "2014-12-20T10:57:57.886000Z",
  "edited": "2014-12-20T20:18:48.516000Z",
  "url": "https://sw.simplr.sh/api/films/5.json"
}
