{
  "title": "The Phantom Menace",
  "episode_id": 1,
  "opening_crawl": "Turmoil has engulfed the\r\nGalactic Republic. The taxation\r\nof trade routes to outlying star\r\nsystems is in dispute.\r\n\r\nHoping to resolve the matter\r\nwith a blockade of deadly\r\nbattleships, the greedy Trade\r\nFederation has stopped all\r\nshipping to the small planet\r\nof Naboo.\r\n\r\nWhile the Congress of the\r\nRepublic endlessly debates\r\nthis alarming chain of events,\r\nthe Supreme Chancellor has\r\nsecretly dispatched two Jedi\r\nKnights, the guardians of\r\npeace and justice in the\r\ngalaxy, to settle the conflict....",
  "director": "George Lucas",
  "producer": "Rick McCallum",
  "release_date": "1999-05-19",
  "characters": [
    "https://sw.simplr.sh/api/people/2.json",
    "https://sw.simplr.sh/api/people/3.json",
    "https://sw.simplr.sh/api/people/10.json",
    "https://sw.simplr.sh/api/people/11.json",
    "https://sw.simplr.sh/api/people/16.json",
    "https://sw.simplr.sh/api/people/20.json",
    "https://sw.simplr.sh/api/people/21.json",
    "https://sw.simplr.sh/api/people/32.json",
    "https://sw.simplr.sh/api/people/33.json",
    "https://sw.simplr.sh/api/people/34.json",
    "https://sw.simplr.sh/api/people/35.json",
    "https://sw.simplr.sh/api/people/36.json",
    "https://sw.simplr.sh/api/people/37.json",
    "https://sw.simplr.sh/api/people/38.json",
    "https://sw.simplr.sh/api/people/39.json",
    "https://sw.simplr.sh/api/people/40.json",
    "https://sw.simplr.sh/api/people/41.json",
    "https://sw.simplr.sh/api/people/42.json",
    "https://sw.simplr.sh/api/people/43.json",
    "https://sw.simplr.sh/api/people/44.json",
    "https://sw.simplr.sh/api/people/46.json",
    "https://sw.simplr.sh/api/people/47.json",
    "https://sw.simplr.sh/api/people/48.json",
    "https://sw.simplr.sh/api/people/49.json",
    "https://sw.simplr.sh/api/people/50.json",
    "https://sw.simplr.sh/api/people/51.json",
    "https://sw.simplr.sh/api/people/52.json",
    "https://sw.simplr.sh/api/people/53.json",
    "https://sw.simplr.sh/api/people/54.json",
    "https://sw.simplr.sh/api/people/55.json",
    "https://sw.simplr.sh/api/people/56.json",
    "https://sw.simplr.sh/api/people/57.json",
    "https://sw.simplr.sh/api/people/58.json",
    "https://sw.simplr.sh/api/people/59.json"
  ],
  "planets": [
    "https://sw.simplr.sh/api/planets/1.json",
    "https://sw.simplr.sh/api/planets/8.json",
    "https://sw.simplr.sh/api/planets/9.json"
  ],
  "starships": [
    "https://sw.simplr.sh/api/starships/31.json",
    "https://sw.simplr.sh/api/starships/32.json",
    "https://sw.simplr.sh/api/starships/39.json",
    "https://sw.simplr.sh/api/starships/40.json",
    "https://sw.simplr.sh/api/starships/41.json"
  ],
  "vehicles": [
    "https://sw.simplr.sh/api/vehicles/33.json",
    "https://sw.simplr.sh/api/vehicles/34.json",
    "https://sw.simplr.sh/api/vehicles/35.json",
    "https://sw.simplr.sh/api/vehicles/36.json",
    "https://sw.simplr.sh/api/vehicles/37.json",
    "https://sw.simplr.sh/api/vehicles/38.json",
    "https://sw.simplr.sh/api/vehicles/42.json"
  ],
  "species": [
    "https://sw.simplr.sh/api/species/1.json",
    "https://sw.simplr.sh/api/species/2.json",
    "https://sw.simplr.sh/api/species/6.json",
    "https://sw.simplr.sh/api/species/11.json",
    "https://sw.simplr.sh/api/species/12.json",
    "https://sw.simplr.sh/api/species/13.json",
    "https://sw.simplr.sh/api/species/14.json",
    "https://sw.simplr.sh/api/species/15.json",
    "https://sw.simplr.sh/api/species/16.json",
    "https://sw.simplr.sh/api/species/17.json",
    "https://sw.simplr.sh/api/species/18.json",
    "https://sw.simplr.sh/api/species/19.json",
    "https://sw.simplr.sh/api/species/20.json",
    "https://sw.simplr.sh/api/species/21.json",
    "https://sw.simplr.sh/api/species/22.json",
    "https://sw.simplr.sh/api/species/23.json",
    "https://sw.simplr.sh/api/species/24.json",
    "https://sw.simplr.sh/api/species/25.json",
    "https://sw.simplr.sh/api/species/26.json",
    "https://sw.simplr.sh/api/species/27.json"
  ],
  "created": "2014-12-19T16:52:55.740000Z",
  "edited": "2014-12-20T10:54:07.216000Z",
  "url": "https://sw.simplr.sh/api/films/4.json"
}
