{
  "title": "The Empire Strikes Back",
  "episode_id": 5,
  "opening_crawl": "It is a dark time for the\r\nRebellion. Although the Death\r\nStar has been destroyed,\r\nImperial troops have driven the\r\nRebel forces from their hidden\r\nbase and pursued them across\r\nthe galaxy.\r\n\r\nEvading the dreaded Imperial\r\nStarfleet, a group of freedom\r\nfighters led by Luke Skywalker\r\nhas established a new secret\r\nbase on the remote ice world\r\nof Hoth.\r\n\r\nThe evil lord Darth Vader,\r\nobsessed with finding young\r\nSkywalker, has dispatched\r\nthousands of remote probes into\r\nthe far reaches of space....",
  "director": "Irvin Kershner",
  "producer": "Gary Kurtz, Rick McCallum",
  "release_date": "1980-05-17",
  "characters": [
    "https://sw.simplr.sh/api/people/1.json",
    "https://sw.simplr.sh/api/people/2.json",
    "https://sw.simplr.sh/api/people/3.json",
    "https://sw.simplr.sh/api/people/4.json",
    "https://sw.simplr.sh/api/people/5.json",
    "https://sw.simplr.sh/api/people/10.json",
    "https://sw.simplr.sh/api/people/13.json",
    "https://sw.simplr.sh/api/people/14.json",
    "https://sw.simplr.sh/api/people/18.json",
    "https://sw.simplr.sh/api/people/20.json",
    "https://sw.simplr.sh/api/people/21.json",
    "https://sw.simplr.sh/api/people/22.json",
    "https://sw.simplr.sh/api/people/23.json",
    "https://sw.simplr.sh/api/people/24.json",
    "https://sw.simplr.sh/api/people/25.json",
    "https://sw.simplr.sh/api/people/26.json"
  ],
  "planets": [
    "https://sw.simplr.sh/api/planets/4.json",
    "https://sw.simplr.sh/api/planets/5.json",
    "https://sw.simplr.sh/api/planets/6.json",
    "https://sw.simplr.sh/api/planets/27.json"
  ],
  "starships": [
    "https://sw.simplr.sh/api/starships/3.json",
    "https://sw.simplr.sh/api/starships/10.json",
    "https://sw.simplr.sh/api/starships/11.json",
    "https://sw.simplr.sh/api/starships/12.json",
    "https://sw.simplr.sh/api/starships/15.json",
    "https://sw.simplr.sh/api/starships/17.json",
    "https://sw.simplr.sh/api/starships/21.json",
    "https://sw.simplr.sh/api/starships/22.json",
    "https://sw.simplr.sh/api/starships/23.json"
  ],
  "vehicles": [
    "https://sw.simplr.sh/api/vehicles/8.json",
    "https://sw.simplr.sh/api/vehicles/14.json",
    "https://sw.simplr.sh/api/vehicles/16.json",
    "https://sw.simplr.sh/api/vehicles/18.json",
    "https://sw.simplr.sh/api/vehicles/19.json",
    "https://sw.simplr.sh/api/vehicles/20.json"
  ],
  "species": [
    "https://sw.simplr.sh/api/species/1.json",
    "https://sw.simplr.sh/api/species/2.json",
    "https://sw.simplr.sh/api/species/3.json",
    "https://sw.simplr.sh/api/species/6.json",
    "https://sw.simplr.sh/api/species/7.json"
  ],
  "created": "2014-12-12T11:26:24.656000Z",
  "edited": "2014-12-15T13:07:53.386000Z",
  "url": "https://sw.simplr.sh/api/films/2.json"
}
