{
  "title": "A New Hope",
  "episode_id": 4,
  "opening_crawl": "It is a period of civil war.\r\nRebel spaceships, striking\r\nfrom a hidden base, have won\r\ntheir first victory against\r\nthe evil Galactic Empire.\r\n\r\nDuring the battle, Rebel\r\nspies managed to steal secret\r\nplans to the Empire's\r\nultimate weapon, the DEATH\r\nSTAR, an armored space\r\nstation with enough power\r\nto destroy an entire planet.\r\n\r\nPursued by the Empire's\r\nsinister agents, Princess\r\nLeia races home aboard her\r\nstarship, custodian of the\r\nstolen plans that can save her\r\npeople and restore\r\nfreedom to the galaxy....",
  "director": "George Lucas",
  "producer": "Gary Kurtz, Rick McCallum",
  "release_date": "1977-05-25",
  "characters": [
    "https://sw.simplr.sh/api/people/1.json",
    "https://sw.simplr.sh/api/people/2.json",
    "https://sw.simplr.sh/api/people/3.json",
    "https://sw.simplr.sh/api/people/4.json",
    "https://sw.simplr.sh/api/people/5.json",
    "https://sw.simplr.sh/api/people/6.json",
    "https://sw.simplr.sh/api/people/7.json",
    "https://sw.simplr.sh/api/people/8.json",
    "https://sw.simplr.sh/api/people/9.json",
    "https://sw.simplr.sh/api/people/10.json",
    "https://sw.simplr.sh/api/people/12.json",
    "https://sw.simplr.sh/api/people/13.json",
    "https://sw.simplr.sh/api/people/14.json",
    "https://sw.simplr.sh/api/people/15.json",
    "https://sw.simplr.sh/api/people/16.json",
    "https://sw.simplr.sh/api/people/18.json",
    "https://sw.simplr.sh/api/people/19.json",
    "https://sw.simplr.sh/api/people/81.json"
  ],
  "planets": [
    "https://sw.simplr.sh/api/planets/1.json",
    "https://sw.simplr.sh/api/planets/2.json",
    "https://sw.simplr.sh/api/planets/3.json"
  ],
  "starships": [
    "https://sw.simplr.sh/api/starships/2.json",
    "https://sw.simplr.sh/api/starships/3.json",
    "https://sw.simplr.sh/api/starships/5.json",
    "https://sw.simplr.sh/api/starships/9.json",
    "https://sw.simplr.sh/api/starships/10.json",
    "https://sw.simplr.sh/api/starships/11.json",
    "https://sw.simplr.sh/api/starships/12.json",
    "https://sw.simplr.sh/api/starships/13.json"
  ],
  "vehicles": [
    "https://sw.simplr.sh/api/vehicles/4.json",
    "https://sw.simplr.sh/api/vehicles/6.json",
    "https://sw.simplr.sh/api/vehicles/7.json",
    "https://sw.simplr.sh/api/vehicles/8.json"
  ],
  "species": [
    "https://sw.simplr.sh/api/species/1.json",
    "https://sw.simplr.sh/api/species/2.json",
    "https://sw.simplr.sh/api/species/3.json",
    "https://sw.simplr.sh/api/species/4.json",
    "https://sw.simplr.sh/api/species/5.json"
  ],
  "created": "2014-12-10T14:23:31.880000Z",
  "edited": "2014-12-20T19:49:45.256000Z",
  "url": "https://sw.simplr.sh/api/films/1.json"
}
