{
  "title": "Return of the Jedi",
  "episode_id": 6,
  "opening_crawl": "Luke Skywalker has returned to\r\nhis home planet of Tatooine in\r\nan attempt to rescue his\r\nfriend Han Solo from the\r\nclutches of the vile gangster\r\nJabba the Hutt.\r\n\r\nLittle does Luke know that the\r\nGALACTIC EMPIRE has secretly\r\nbegun construction on a new\r\narmored space station even\r\nmore powerful than the first\r\ndreaded Death Star.\r\n\r\nWhen completed, this ultimate\r\nweapon will spell certain doom\r\nfor the small band of rebels\r\nstruggling to restore freedom\r\nto the galaxy...",
  "director": "Richard Marquand",
  "producer": "Howard G. Kazanjian, George Lucas, Rick McCallum",
  "release_date": "1983-05-25",
  "characters": [
    "https://sw.simplr.sh/api/people/1.json",
    "https://sw.simplr.sh/api/people/2.json",
    "https://sw.simplr.sh/api/people/3.json",
    "https://sw.simplr.sh/api/people/4.json",
    "https://sw.simplr.sh/api/people/5.json",
    "https://sw.simplr.sh/api/people/10.json",
    "https://sw.simplr.sh/api/people/13.json",
    "https://sw.simplr.sh/api/people/14.json",
    "https://sw.simplr.sh/api/people/16.json",
    "https://sw.simplr.sh/api/people/18.json",
    "https://sw.simplr.sh/api/people/20.json",
    "https://sw.simplr.sh/api/people/21.json",
    "https://sw.simplr.sh/api/people/22.json",
    "https://sw.simplr.sh/api/people/25.json",
    "https://sw.simplr.sh/api/people/27.json",
    "https://sw.simplr.sh/api/people/28.json",
    "https://sw.simplr.sh/api/people/29.json",
    "https://sw.simplr.sh/api/people/30.json",
    "https://sw.simplr.sh/api/people/31.json",
    "https://sw.simplr.sh/api/people/45.json"
  ],
  "planets": [
    "https://sw.simplr.sh/api/planets/1.json",
    "https://sw.simplr.sh/api/planets/5.json",
    "https://sw.simplr.sh/api/planets/7.json",
    "https://sw.simplr.sh/api/planets/8.json",
    "https://sw.simplr.sh/api/planets/9.json"
  ],
  "starships": [
    "https://sw.simplr.sh/api/starships/2.json",
    "https://sw.simplr.sh/api/starships/3.json",
    "https://sw.simplr.sh/api/starships/10.json",
    "https://sw.simplr.sh/api/starships/11.json",
    "https://sw.simplr.sh/api/starships/12.json",
    "https://sw.simplr.sh/api/starships/15.json",
    "https://sw.simplr.sh/api/starships/17.json",
    "https://sw.simplr.sh/api/starships/22.json",
    "https://sw.simplr.sh/api/starships/23.json",
    "https://sw.simplr.sh/api/starships/27.json",
    "https://sw.simplr.sh/api/starships/28.json",
    "https://sw.simplr.sh/api/starships/29.json"
  ],
  "vehicles": [
    "https://sw.simplr.sh/api/vehicles/8.json",
    "https://sw.simplr.sh/api/vehicles/16.json",
    "https://sw.simplr.sh/api/vehicles/18.json",
    "https://sw.simplr.sh/api/vehicles/19.json",
    "https://sw.simplr.sh/api/vehicles/24.json",
    "https://sw.simplr.sh/api/vehicles/25.json",
    "https://sw.simplr.sh/api/vehicles/26.json",
    "https://sw.simplr.sh/api/vehicles/30.json"
  ],
  "species": [
    "https://sw.simplr.sh/api/species/1.json",
    "https://sw.simplr.sh/api/species/2.json",
    "https://sw.simplr.sh/api/species/3.json",
    "https://sw.simplr.sh/api/species/5.json",
    "https://sw.simplr.sh/api/species/6.json",
    "https://sw.simplr.sh/api/species/8.json",
    "https://sw.simplr.sh/api/species/9.json",
    "https://sw.simplr.sh/api/species/10.json",
    "https://sw.simplr.sh/api/species/15.json"
  ],
  "created": "2014-12-18T10:39:33.255000Z",
  "edited": "2014-12-20T09:48:37.462000Z",
  "url": "https://sw.simplr.sh/api/films/3.json"
}
